{"$defs":{"compatibility_record":{"additionalProperties":false,"properties":{"bundle_id":{"maxLength":64,"minLength":64,"pattern":"^[0-9a-f]{64}$","type":"string"},"validator_sha256":{"maxLength":64,"minLength":64,"pattern":"^[0-9a-f]{64}$","type":"string"}},"required":["bundle_id","validator_sha256"],"type":"object"}},"$id":"urn:daw:schema:dc24b657d17c28a043bb29306582f2730a939b5eb81d5e3fda8d8bd1108b6630","$schema":"https://json-schema.org/draft/2020-12/schema","additionalProperties":false,"properties":{"anchor_id":{"maxLength":64,"minLength":64,"pattern":"^[0-9a-f]{64}$","type":"string"},"anchor_version":{"const":"1","pattern":"^(0|[1-9][0-9]*)$","type":"string"},"compatibility":{"items":{"$ref":"#/$defs/compatibility_record"},"type":"array"},"current_bundle_id":{"maxLength":64,"minLength":64,"pattern":"^[0-9a-f]{64}$","type":"string"},"schema_id":{"maxLength":64,"minLength":64,"pattern":"^[0-9a-f]{64}$","type":"string"},"validator_sha256":{"maxLength":64,"minLength":64,"pattern":"^[0-9a-f]{64}$","type":"string"}},"required":["anchor_id","anchor_version","compatibility","current_bundle_id","schema_id","validator_sha256"],"type":"object"}