{"anchor_id":"465ef55732840fdb90932c1c5c850cde73fc22b07757aae5aa723c4c08fa1f46","anchor_version":"1","compatibility":[],"current_bundle_id":"27eb0a899abce5a888e2bdab5932e5cd9541e43e6c2fac3ca42df84ba980a080","schema_id":"dc24b657d17c28a043bb29306582f2730a939b5eb81d5e3fda8d8bd1108b6630","validator_sha256":"07bb5b1107c55172e595375743dda9bb7340efc8798f02fbb9a376cee65e8bd6"}